[
  {
    "file_format": ".cpp",
    "tier": 1,
    "purpose": "Expose native application, embedded and manufacturing-software logic and dependencies that plain text chunking would miss.",
    "rag_ingestion": "Prebundle a C/C++ parser such as tree-sitter/Clang tooling: extract namespaces, classes, functions, includes, symbols and call/include relationships; convert to structured metadata before Cognee graph ingestion and OKF provenance mapping.",
    "example": "https://github.com/tree-sitter/tree-sitter-cpp/blob/master/examples/parser.cc"
  },
  {
    "file_format": ".eml",
    "tier": 1,
    "purpose": "Turn operational email into searchable decisions, approvals, requests, handoffs and actor relationships while preserving message-level provenance.",
    "rag_ingestion": "Cognee supports .eml through its document loader. Extract message headers, participants, timestamps, subject, body and attachments; model sender/recipient/thread relationships before graph ingestion. Map original message/resource and extracted claims into OKF sources for provenance.",
    "example": "https://raw.githubusercontent.com/python/cpython/main/Lib/test/test_email/data/msg_01.txt"
  },
  {
    "file_format": ".go",
    "tier": 1,
    "purpose": "Capture service, CLI, infrastructure and backend workflow logic written in Go, including package-level relationships.",
    "rag_ingestion": "Prebundle Go parser/AST tooling: extract packages, structs, interfaces, functions, imports and call/dependency relationships; serialize to structured metadata, ingest into Cognee, and retain repository/file source references in OKF.",
    "example": "https://github.com/golang/go/blob/master/src/go/ast/ast.go"
  },
  {
    "file_format": ".js",
    "tier": 1,
    "purpose": "Capture application and automation logic, API clients, workflow code and module dependencies from JavaScript codebases.",
    "rag_ingestion": "Prebundle a JavaScript/ESTree-compatible AST parser: extract functions, classes, imports/exports, calls and comments; serialize symbols/edges to structured JSON or Markdown, then ingest into Cognee and preserve repository/file provenance for OKF.",
    "example": "https://github.com/estree/estree/blob/master/es5.md"
  },
  {
    "file_format": ".json",
    "tier": 1,
    "purpose": "Configuration, API payloads, BOMs, manifests and machine-generated metadata where key/value structure should become graph context.",
    "rag_ingestion": "Cognee TextLoader supports JSON. Parse JSON structurally first when keys/arrays encode domain entities; retain object paths and IDs, then ingest normalized text/records into Cognee. OKF can reference the source resource and record provenance/trust signals for generated concepts.",
    "example": "https://raw.githubusercontent.com/typicode/demo/master/db.json"
  },
  {
    "file_format": ".md",
    "tier": 1,
    "purpose": "Knowledge-base pages, engineering docs, runbooks, ADRs and other already-structured human/agent-readable context; ideal bridge into OKF.",
    "rag_ingestion": "Ingest directly with Cognee TextLoader. Preserve headings, lists, links and code blocks as semantic structure; chunk/embed/graph in Cognee. Markdown is also the native body format for an OKF concept, with YAML frontmatter carrying type, resource, sources, generated/verified, status and freshness signals.",
    "example": "https://github.com/GoogleCloudPlatform/open-knowledge-format/blob/main/README.md"
  },
  {
    "file_format": ".msg",
    "tier": 1,
    "purpose": "Extract enterprise context from Outlook messages: decisions, approvals, escalations, commitments and participant relationships.",
    "rag_ingestion": "Use Cognee's document loader with the docs extra, or a prebundled MSG extractor where Outlook-specific properties/attachments need higher fidelity. Normalize sender/recipients/time/subject/body/attachments, then ingest into Cognee and preserve source identity in OKF.",
    "example": "https://github.com/TeamMsgExtractor/msg-extractor"
  },
  {
    "file_format": ".py",
    "tier": 1,
    "purpose": "Recover executable workflow logic, business rules, agent/tool implementations and dependencies from Python repositories instead of treating code as undifferentiated text.",
    "rag_ingestion": "Prebundle a Python AST parser before Cognee: extract modules, classes, functions, signatures, imports, docstrings and call/dependency relationships into structured text/JSON; ingest those artifacts into Cognee and link source paths as provenance in OKF.",
    "example": "https://github.com/python/cpython/blob/main/Lib/ast.py"
  },
  {
    "file_format": ".sql",
    "tier": 1,
    "purpose": "Recover database structure, lineage and governed calculation logic; especially useful for enterprise analytics and workflow dependencies.",
    "rag_ingestion": "Preparse SQL as DDL/query syntax: extract schemas, tables, columns, constraints, joins, referenced objects and statements. Send schema/lineage metadata to Cognee rather than only raw SQL text; represent sanctioned computations in OKF as Attested Computation when applicable.",
    "example": "https://github.com/sqlite/sqlite/blob/master/test/schema.test"
  },
  {
    "file_format": ".txt",
    "tier": 1,
    "purpose": "Runbooks, SOPs, requirements, notes and logs that are already textual; lowest-friction source for entity, relationship and procedural-context extraction.",
    "rag_ingestion": "Use Cognee TextLoader to normalize UTF-8/plain text directly. Preserve filename, MIME type, extension and content hash; then chunk/embed/graph with Cognee. Emit selected enterprise concepts as OKF Markdown with YAML frontmatter and source provenance.",
    "example": "https://raw.githubusercontent.com/GoogleCloudPlatform/open-knowledge-format/main/README.md"
  },
  {
    "file_format": ".xml",
    "tier": 1,
    "purpose": "System configuration, integrations, structured BOM/engineering metadata and XML-based enterprise interchange formats.",
    "rag_ingestion": "Cognee TextLoader supports XML, but preparse XML trees when hierarchy/attributes are meaningful. Convert elements, attributes, IDs and references into structured records before graph ingestion; retain original resource and source metadata in OKF.",
    "example": "https://www.w3.org/TR/xml/#sec-well-formed"
  },
  {
    "file_format": ".yaml",
    "tier": 1,
    "purpose": "Configuration, CI/CD, infrastructure, manifests and API/tool definitions where hierarchy and keys carry workflow meaning.",
    "rag_ingestion": "Cognee TextLoader supports YAML. Parse mappings/lists/anchors structurally where configuration semantics matter, normalize to deterministic JSON/text for Cognee, and retain the original file as an OKF source/resource.",
    "example": "https://raw.githubusercontent.com/OAI/OpenAPI-Specification/main/examples/v3.0/petstore.yaml"
  },
  {
    "file_format": "FastMCP Spec",
    "tier": 1,
    "purpose": "Give FDE agents context about available MCP tools, their schemas, capabilities and where each tool fits in an enterprise workflow.",
    "rag_ingestion": "Parse MCP/FastMCP server declarations and tool metadata into server, tool, input-schema, output and resource/prompt relationships; ingest the normalized manifest into Cognee and expose tool concepts/resources through OKF references.",
    "example": "https://github.com/jlowin/fastmcp/blob/main/examples/echo.py"
  },
  {
    "file_format": "ODB++",
    "tier": 1,
    "purpose": "High-fidelity PCB manufacturing context for FDEs: board structure, connectivity, components and fabrication/assembly data beyond natural-language documents.",
    "rag_ingestion": "Prebundle an ODB++ archive/parser: unpack the job, extract layer stack, nets, components, drill/rout, materials and manufacturing attributes into normalized JSON. Ingest the structured engineering entities/relationships into Cognee and attach job/source provenance through OKF.",
    "example": "https://odbplusplus.com/design/"
  },
  {
    "file_format": "OpenAPI",
    "tier": 1,
    "purpose": "Give FDE agents machine-readable knowledge of enterprise APIs, contracts, payloads, authentication requirements and service relationships.",
    "rag_ingestion": "Parse OpenAPI JSON/YAML deterministically before Cognee: extract paths, operations, parameters, request/response schemas, security schemes and component references as entities/edges. Ingest structured output into Cognee; publish API concepts in OKF with resource/source links and lifecycle metadata.",
    "example": "https://github.com/OAI/OpenAPI-Specification/blob/main/examples/v3.0/petstore.yaml"
  },
  {
    "file_format": "Swagger",
    "tier": 1,
    "purpose": "Understand legacy API contracts and map operations to services, data objects and integration workflows.",
    "rag_ingestion": "Parse Swagger/OpenAPI 2.0 definitions into endpoints, HTTP methods, parameters, definitions, responses and security metadata; normalize to structured JSON/Markdown before Cognee and retain the specification URI as OKF provenance.",
    "example": "https://petstore.swagger.io/v2/swagger.json"
  },
  {
    "file_format": "Web URL / HTML",
    "tier": 1,
    "purpose": "Bring public/internal web documentation, wiki pages, product docs and web-based runbooks into the enterprise context graph while retaining source URLs.",
    "rag_ingestion": "For a webpage URL, Cognee fetches HTML and extracts text with its URL crawler; direct binary-file URLs should be downloaded by the ingestion gateway first rather than passed as webpage URLs. Normalize page text/metadata, ingest into Cognee, and store the canonical resource URL in OKF frontmatter/sources.",
    "example": "https://docs.cognee.ai/core-concepts/main-operations/legacy-operations/add"
  },
  {
    "file_format": ".csv",
    "tier": 2,
    "purpose": "Flat master data, exports, mappings and transactional extracts such as Part Number→Supplier or Customer→Account relationships.",